{
    "schemaVersion": 1,
    "generatedAt": "2026-07-07T00:41:42+00:00",
    "createdDirs": [
        ".claude/agents",
        ".claude/skills",
        ".claude/commands",
        "docs/ai/capabilities/dependency-upgrade",
        "docs/ai/capabilities/mentor-mode",
        ".opencode/agents-optional",
        ".github/agents",
        "docs/ai/capabilities/preview-environments",
        "docs/ai/capabilities/evaluation-and-regression",
        "docs/ai/capabilities/service-boundary-patterns",
        "tools/ai/advisor",
        "docs/ai/package",
        "policies",
        "tools/ai/install/permission-layers",
        "tools/ai/validation",
        "tools/ai/commands",
        "docs/ai/shared/approvals",
        "docs/ai/shared/verification",
        "docs/ai/snippets",
        "scripts/ai/internal",
        "scripts/ai/bin",
        "tools/ai/sh-introspect",
        ".github/instructions",
        ".github/prompts",
        ".github/skills",
        ".opencode/agents",
        ".opencode/skills",
        ".opencode/commands",
        "docs/ai/capabilities/bug-regression",
        "docs/ai/capabilities/release-safety",
        "docs/ai/capabilities/project-context",
        "docs/ai/capabilities/verify-change",
        "docs/ai/capabilities/review-diff",
        "docs/ai/capabilities/evidence-first-execution",
        "docs/ai/capabilities/clarification-and-handoff",
        "docs/ai/capabilities/agent-observability-and-evidence",
        "docs/ai/capabilities/authorization-and-tool-governance",
        "docs/ai/capabilities/config-change-safety",
        "docs/ai/capabilities/docs-sync",
        "docs/ai/capabilities/adapter-drift"
    ],
    "entries": [
        {
            "path": ".ai/catalog.json",
            "ownership": "owned",
            "component": "target-tools-pack",
            "runtimes": [
                "both"
            ],
            "source": "packages/ai-universal-rules/catalog.json",
            "generator": "installer",
            "sha256": "sha256:acd059029eefafa1dd0d5cbd48d0e606a189d50c63830af3878a500171d9df40",
            "mode": "0600",
            "lineEnding": "lf",
            "kitVersion": "unknown",
            "schemaVersion": 1
        },
        {
            "path": ".ai/kit-manifest.json",
            "ownership": "owned",
            "component": "target-tools-pack",
            "runtimes": [
                "both"
            ],
            "source": "packages/ai-universal-rules/manifest.json",
            "generator": "installer",
            "sha256": "sha256:ace1bce3ee5325475ddcba35d23820cc1c7e16122b3ae286b02d20c553f65be3",
            "mode": "0644",
            "lineEnding": "lf",
            "kitVersion": "unknown",
            "schemaVersion": 1
        },
        {
            "path": ".ai/kit-manifest.yml",
            "ownership": "owned",
            "component": "target-tools-pack",
            "runtimes": [
                "both"
            ],
            "source": "packages/ai-universal-rules/manifest.yml",
            "generator": "installer",
            "sha256": "sha256:42780efc6a376b6f76c158784d652fe15dff00440402641ba7f46cc3171cc9a0",
            "mode": "0644",
            "lineEnding": "lf",
            "kitVersion": "unknown",
            "schemaVersion": 1
        },
        {
            "path": ".ai/package-lock.ai.json",
            "ownership": "owned",
            "component": "target-tools-pack",
            "runtimes": [
                "both"
            ],
            "source": "packages/ai-universal-rules/package-lock.ai.json",
            "generator": "installer",
            "sha256": "sha256:6bd37703f2230f786a7c811c81e170b1727c80456125f74e80d48c334fe7a0e4",
            "mode": "0644",
            "lineEnding": "lf",
            "kitVersion": "unknown",
            "schemaVersion": 1
        },
        {
            "path": ".ai/placeholders.json",
            "ownership": "owned",
            "component": "setup-docs",
            "runtimes": [
                "both"
            ],
            "source": "packages/ai-universal-rules/placeholders.json",
            "generator": "installer",
            "sha256": "sha256:f5fc22266030fd10eab06f69eef752c7a4c85bd94c2f90d9d2992c9ec16d2aa1",
            "mode": "0644",
            "lineEnding": "lf",
            "kitVersion": "unknown",
            "schemaVersion": 1
        },
        {
            "path": ".ai/project.yml",
            "ownership": "template",
            "component": "project-values",
            "runtimes": [
                "both"
            ],
            "source": ".ai/project.yml",
            "generator": "installer",
            "sha256": "sha256:3aff15138bcda32b623299318a05ec844d927811dd31653a1fdedc91cb3c16cb",
            "mode": "0644",
            "lineEnding": "lf",
            "kitVersion": "unknown",
            "schemaVersion": 1
        },
        {
            "path": ".claude/agents",
            "ownership": "template",
            "component": "optional-agents-claude-pack",
            "runtimes": [
                "claude-code"
            ],
            "source": "packages/ai-universal-rules/templates/optional/agents",
            "generator": "installer",
            "sha256": "sha256:ccd79a4d297247493a3a2b32ef810a9d78f25b57b7952430ff2580be7ba00396",
            "mode": "0777",
            "lineEnding": "none",
            "kitVersion": "unknown",
            "schemaVersion": 1
        },
        {
            "path": ".claude/commands",
            "ownership": "owned",
            "component": "adapter-claude",
            "runtimes": [
                "both"
            ],
            "source": "packages/ai-universal-rules/templates/commands",
            "generator": "installer",
            "sha256": "sha256:05309fb08b5bbf9b1a4b87df678d8bc0c56567eabab7a31021e8c5502e411ad9",
            "mode": "0777",
            "lineEnding": "none",
            "kitVersion": "unknown",
            "schemaVersion": 1
        },
        {
            "path": ".claude/settings.json",
            "ownership": "owned",
            "component": "adapter-claude",
            "runtimes": [
                "both"
            ],
            "source": "packages/ai-universal-rules/templates/claude/settings.json",
            "generator": "installer",
            "sha256": "sha256:18f8b4f1cc438099b0b6185b1b8b6231ba9496ac2908f6ebb6a88aa86ded0531",
            "mode": "0644",
            "lineEnding": "lf",
            "kitVersion": "unknown",
            "schemaVersion": 1
        },
        {
            "path": ".claude/skills",
            "ownership": "owned",
            "component": "adapter-claude",
            "runtimes": [
                "both"
            ],
            "source": "packages/ai-universal-rules/templates/workflows",
            "generator": "installer",
            "sha256": "sha256:5783e798a2c65326b4e67e7d4df8035718da352deb7bee63c7b2e83fd08db61e",
            "mode": "0777",
            "lineEnding": "none",
            "kitVersion": "unknown",
            "schemaVersion": 1
        },
        {
            "path": ".github/agents",
            "ownership": "owned",
            "component": "adapter-copilot",
            "runtimes": [
                "github-copilot"
            ],
            "source": "packages/ai-universal-rules/templates/core/agents",
            "generator": "installer",
            "sha256": "sha256:a3846391763cae6e7faea6219cf7dd488451b1a14e5705fd52e3278fc5f24efb",
            "mode": "0755",
            "lineEnding": "none",
            "kitVersion": "unknown",
            "schemaVersion": 1
        },
        {
            "path": ".github/copilot-instructions.md",
            "ownership": "owned",
            "component": "adapter-copilot",
            "runtimes": [
                "github-copilot"
            ],
            "source": "packages/ai-universal-rules/templates/core/copilot-instructions.template.md",
            "generator": "installer",
            "sha256": "sha256:6961917ec2671d4ce938eab179e5c29e410bfe8ee96fd2fe6219befc4c62eb79",
            "mode": "0644",
            "lineEnding": "lf",
            "kitVersion": "unknown",
            "schemaVersion": 1
        },
        {
            "path": ".github/hooks/scripts/command-policy.compiled.sh",
            "ownership": "owned",
            "component": "hooks-pack",
            "runtimes": [
                "both"
            ],
            "source": "packages/ai-universal-rules/templates/github/hooks/scripts/command-policy.compiled.sh",
            "generator": "installer",
            "sha256": "sha256:1cc4b343b7deb63a269f02946500f6be558522fa2e6b05e7acf29fe30a5c39a4",
            "mode": "0755",
            "lineEnding": "lf",
            "kitVersion": "unknown",
            "schemaVersion": 1
        },
        {
            "path": ".github/hooks/scripts/tool-guardian.ps1",
            "ownership": "owned",
            "component": "hooks-pack",
            "runtimes": [
                "both"
            ],
            "source": "packages/ai-universal-rules/templates/github/hooks/scripts/tool-guardian.ps1",
            "generator": "installer",
            "sha256": "sha256:0e491f43f4ca754b74a45a1f3939e1dc6de7726e3da24cdb74cbf3c63c141f45",
            "mode": "0644",
            "lineEnding": "lf",
            "kitVersion": "unknown",
            "schemaVersion": 1
        },
        {
            "path": ".github/hooks/scripts/tool-guardian.sh",
            "ownership": "owned",
            "component": "hooks-pack",
            "runtimes": [
                "both"
            ],
            "source": "packages/ai-universal-rules/templates/github/hooks/scripts/tool-guardian.sh",
            "generator": "installer",
            "sha256": "sha256:f45d13e63415ec5bdea267bd7d4c1144e8261f3b9c7476b796cb911a0d9adb4f",
            "mode": "0755",
            "lineEnding": "lf",
            "kitVersion": "unknown",